id,name,description
5287,Shadow Walk,"Bounty Hunter becomes invisible and gains the ability to move through other units until he attacks or uses an ability.  If he breaks the invisibility with an attack, that attack will slow the target's movement speed."
5288,Track,"Tracks an enemy hero, granting True Sight of the target, and information on how much gold it is carrying. Bounty Hunter moves fast when near the tracked unit and deals critical strikes when attacking it. If the target dies, Bounty Hunter and nearby heroes collect a bonus bounty of gold. Casting Track does not take you out of invisibility."
5289,The Swarm,"Weaver launches a swarm of %count% young Weavers that latch on any enemy unit in their path, attacking and reducing armor until it is killed."
5290,Shukuchi,"Weaver shifts out of visibility, gaining max movement speed --doing harm to any enemies it passes through."
5291,Geminate Attack,Allows Weaver to dispatch two attacks at once.
5292,Time Lapse,"Weaver warps backward to whatever position it was in five seconds earlier--regaining the HP and mana from that time. No effect on cooldown, gold or experience.

DISPEL TYPE: Strong Dispel"
5297,Dual Breath,"An icy blast followed by a wave of fire launches out in a path in front of Jakiro. The ice slows enemies, while the fire delivers damage over time."
5298,Ice Path,Creates a path of ice that stuns and damages enemies that touch it.
5299,Liquid Fire,"Jakiro burns his enemies in an area of effect with fire added to his attack, while slowing their attacks."
553,Liquid Frost,Stuns enemies for %stun_duration% seconds and applies a frost debuff that slows enemy movement speed by %movement_slow%%% and take %base_damage% plus %pct_health_damage%%% of their max health per second as damage for %duration% seconds.
5300,Macropyre,"Jakiro exhales a wide line of lasting flames, which deals damage per second to any enemy units caught in the fire."
5320,Sticky Napalm,"Drenches an area in sticky oil, amplifying damage from Batrider's attacks and abilities and slowing the movement speed and turn rate of enemies in the area.  Additional casts of Sticky Napalm continue to increase damage, up to %max_stacks% stacks."
5321,Flamebreak,"Hurls an explosive cocktail that explodes when it reaches the target location, knocking back, and dealing damage over time to enemies in the area."
5322,Firefly,"Batrider takes to the skies, laying down a trail of flames from the air.  The fire damages any enemies it touches, and destroys trees below Batrider. Batrider has bonus day/night vision while Firefly is active."
5323,Flaming Lasso,"Lassoes an enemy and drags them in Batrider's wake. Dragged units cannot move, attack, or use abilities.  Teleporting or blinking will break the lasso."
5328,Penitence,Forces an enemy unit to move slower and for allies to attack it more quickly.
5330,Holy Persuasion,"Chen takes control of an enemy or neutral creep. If the persuaded creep's base health is naturally below the health minimum, its base health will be raised to the health minimum. Converted creeps will have increased movement speed and bonus damage. 

Can be cast on converted creeps to teleport them to Chen. If cast on Chen, all units controlled by Chen will be teleported to him. Taking damage will dispel the buff."
7306,Divine Favor,Passively provides an aura that grants increased health regeneration and armor.
5331,Hand of God,Heals all allied heroes on the map as well as all units under Chen's control.
5334,Spectral Dagger,"Spectre flings a dagger to draw a Shadow Path, dealing damage and slowing the movement speed of any enemies along the trail. Units hit by the dagger also trail a Shadow Path. While treading the path, Spectre phases through otherwise impassable terrain."
5335,Desolate,Deals bonus damage whenever Spectre attacks an enemy that does not have any allied units within a %radius% radius around them.
5336,Dispersion,"Damage done to Spectre is reflected on her enemies, leaving her unharmed. The effect lessens with distance."
7851,Shadow Step,Allows Spectre to perform a single target unit Haunt. Casts a Spectral Dagger on the target.
5337,Haunt,"Creates a spectral nemesis to attack each enemy hero. At any moment during the duration, Spectre can use Reality to exchange places of a given haunt.

Haunt illusions are uncontrollable, take extra damage, and deal less damage than Spectre herself.  They ignore terrain."
5345,Cold Feet,"Places a frozen hex on an enemy unit that deals damage over time, but can be dispelled by moving away from the initial cast point.  If the enemy unit doesn't move outside of the given range, it will be stunned and frozen in place after 4 seconds."
5346,Ice Vortex,Creates a vortex of icy energy that slows and increases magic damage done to enemies in its range.
5347,Chilling Touch,"Enhances Ancient Apparition's attack with increased range, heavy magic damage, and movement slow."
5348,Ice Blast,"Launches a tracer toward any location on the battlefield, which must be triggered again to mark the area to be blasted by a damaging explosion of hail. The further the tracer travels, the larger the explosion will be. Enemies caught in the explosion, or who touch the icy ball of hail as it travels, are Frostbitten, taking damage and prevented from regenerating or healing. If a Frostbitten unit's health drops below a certain percentage, they will instantly shatter."
5339,Devour,"Consumes an enemy or neutral creep, acquiring any special abilities that it possessed. If autocast is deactivated, Doom will not acquire the creep's abilities. Duration is equal to the cooldown."
5340,Scorched Earth,"Carpets the nearby earth in flames which damage enemies, while also granting him increased movement speed."
5341,Infernal Blade,"Doom swings his burning sword, igniting the enemy. Stuns for %ministun_duration% seconds and applies a %burn_duration% second burn that deals a base damage plus a percentage of the target's Max HP as damage per second."
5342,Doom,"Inflicts a curse that dispels an enemy Hero and prevents an them from casting spells or using items, while taking damage over time.

DISPEL TYPE: Basic Dispel"
5357,Earthshock,"Ursa leaps forward %hop_distance% units and slams the earth, causing a powerful shock to damage and slow all enemy units in a nearby area for %abilityduration% seconds."
5358,Overpower,"Using his skill in combat, Ursa gains increased attack speed for a number of subsequent attacks."
5359,Fury Swipes,"Ursa's claws dig deeper wounds in the enemy, causing consecutive attacks to the same enemy to deal more damage.  If the same target is not attacked after %bonus_reset_time% seconds, the bonus damage is lost."
5360,Enrage,"Ursa goes into a frenzy, providing damage reduction and status resistance. Removes any existing debuffs.

DISPEL TYPE: Strong Dispel"
5353,Charge of Darkness,"Spirit Breaker fixes his sight on an enemy unit and starts charging through all objects.  All enemy units passed through and the targeted unit will be hit by a Greater Bash.  If the targeted unit dies, Spirit Breaker will change his target to the nearest enemy unit to that location."
7301,Bulldoze,Spirit Breaker gains movement speed and status resistance to ram through enemies. Can be used while charging.
5355,Greater Bash,Gives a chance to stun and knockback an enemy unit on an attack. Deals a percentage of movement speed as damage. Deals 1.5x damage to creeps.
5356,Nether Strike,"Spirit Breaker slips into the nether realm, reappearing next to his hapless victim. Upon reappearing, a Greater Bash of the current level occurs and deals bonus damage. Knocks back for double the normal distance."
5361,Rocket Barrage,Launches a salvo of rockets at nearby enemy units in a radius around the Gyrocopter.  Lasts %abilityduration% seconds.
5362,Homing Missile,"Fires a homing missile to seek the targeted enemy unit. The missile gains speed over time, dealing damage and stunning when it impacts the target. Enemy units can destroy the missile before it reaches its target."
5363,Flak Cannon,Gyrocopter's attacks hit all enemy units in an area around it for a limited number of attacks.  Only the main target of attacks will receive attack bonuses such as Critical Strike.  Lasts %abilityduration% seconds or until the attacks are used.
5364,Call Down,"Call down an aerial missile strike on enemy units in a target area. After %missile_delay_tooltip% seconds, two missiles arrive in succession, with %missile_delay_tooltip% seconds between them."
5365,Acid Spray,Sprays high-pressure acid across a target area. Enemy units who step across the contaminated terrain take damage per second and have their armor reduced.
5366,Unstable Concoction,"Alchemist brews up an unstable concoction that he can throw at an enemy hero, to stun and deal damage in an area around the explosion. The longer the concoction brews, the more damage it deals and the longer the stun. After %brew_time% seconds, the brew reaches its maximum damage and stun time. However, after %brew_explosion% seconds, the concoction will explode on Alchemist himself if not thrown."
5368,Greevil's Greed,"Alchemist synthesizes additional gold from his enemies and bounty runes. With each kill, Alchemist earns base bonus gold and extra bonus gold. If Alchemist kills another unit which yields gold within the next %duration% seconds, an additional instance of Extra Bonus Gold is added to the total. Additionally, causes bounty runes to yield more gold."
642,Berserk Potion,"Alchemist throws a potion at an ally, applying a basic dispel and giving them %attack_speed% Attack Speed, %move_speed% Movement Speed and %hp_regen% HP regen.<br><br>Lasts %duration% seconds."
5369,Chemical Rage,"Alchemist causes his Ogre to enter a chemically induced rage, reducing base attack cooldown and increasing movement speed and health regeneration.

DISPEL TYPE: Basic Dispel"
5370,Quas,"Allows manipulation of ice elements. Each <font color='#7998b5'>Quas</font> instance provides increased health regeneration.
"
5371,Wex,Allows manipulation of storm elements. Each <font color='#d671a9'>Wex</font> instance provides increased attack speed and movement speed.
5372,Exort,Allows manipulation of fire elements. Each <font color='#cabe68'>Exort</font> instance provides increased attack damage.
5375,Invoke,Combines the properties of the elements currently being manipulated to create a new spell for Invoker to use. Invoke cooldown is reduced by %cooldown_reduction_per_orb% seconds for each orb level. <br><br> Click the help button to see the list of possible spells.
5376,Cold Snap,"Invoker draws the heat from an enemy, chilling them to their very core for a duration based on the level of <font color='#7998b5'>Quas</font>. The enemy will take damage and be briefly frozen. Further damage taken in this state will freeze the enemy again, dealing bonus damage. The enemy can only be frozen so often, but the freeze cooldown decreases based on the level of <font color='#7998b5'>Quas</font>."
5381,Ghost Walk,"Invoker manipulates the ice and electrical energies around him, rendering his body invisible. The elemental imbalance created as a consequence slows nearby enemies based on the level of <font color='#7998b5'>Quas</font>, and slows Invoker as well based on the level of <font color='#d671a9'>Wex</font>."
5382,Tornado,"Unleashes a fast moving tornado that picks up enemy units in its path, suspending them helplessly in the air shortly before allowing them to plummet to their doom. Travels further based on the level of <font color='#d671a9'>Wex</font>. Holds enemies in the air for a duration based on the level of <font color='#7998b5'>Quas</font>. Deals base damage plus added damage based on levels in <font color='#d671a9'>Wex</font>.

DISPEL TYPE: Basic Dispel"
5383,E.M.P.,"Invoker builds up a charge of electromagnetic energy at a targeted location which automatically detonates after %delay% seconds. The detonation covers an area, draining mana based on the level of <font color='#d671a9'>Wex</font>. Deals damage for each point of mana drained.  If EMP drains mana from an enemy hero, Invoker gains 50% of the mana drained."
5384,Alacrity,"Invoker infuses an ally with an immense surge of energy, increasing their attack speed based on the level of <font color='#d671a9'>Wex</font> and their damage based on the level of <font color='#cabe68'>Exort</font>."
5385,Chaos Meteor,"Invoker pulls a flaming meteor from space onto the targeted location. Upon landing, the meteor rolls forward, constantly dealing damage based on the level of <font color='#cabe68'>Exort</font>, and rolling further based on the level of <font color='#d671a9'>Wex</font>. Units hit by the meteor will also be set on fire for a short time, receiving additional damage based on the level of <font color='#cabe68'>Exort</font>."
5386,Sun Strike,"Sends a catastrophic ray of fierce energy from the sun at any targeted location, incinerating all enemies standing beneath it once it reaches the earth. Deals damage based on the level of <font color='#cabe68'>Exort</font>, however this damage is spread evenly over all enemies hit."
5387,Forge Spirit,"Invoker forges a spirit embodying the strength of fire and fortitude of ice. Damage and armor are based on the level of <font color='#cabe68'>Exort</font> while attack range, health, and duration are based on the level of <font color='#7998b5'>Quas</font>. The elemental's scorching attack is capable of melting the armor of enemy heroes. Spawns two spirits when Quas and Exort are at least level 4."
5389,Ice Wall,Generates a wall of solid ice directly in front of Invoker for a duration based on the level of <font color='#7998b5'>Quas</font>. The bitter cold emanating from it greatly slows nearby enemies based on the level of <font color='#7998b5'>Quas</font> and deals damage each second based on the level of <font color='#cabe68'>Exort</font>.
5390,Deafening Blast,"Invoker unleashes a mighty sonic wave in front of him, dealing damage to any enemy unit it collides with based on the level of <font color='#cabe68'>Exort</font>. The sheer impact from the blast is enough to knock those enemy units back for a duration based on the level of <font color='#7998b5'>Quas</font>, then disarm their attacks for a duration based on the level of <font color='#d671a9'>Wex</font>."
5377,Arcane Curse,"Curses the target area, causing enemy heroes to take damage and slowing their movement speed. Silenced enemies take 2x slow and damage. Anytime affected enemies cast a spell, the duration is increased. The cooldown is paused as long as the target is silenced."
5378,Glaives of Wisdom,"Silencer enchants his glaives with his wisdom, dealing additional damage based on his Intelligence. Silencer temporarily steals his target's Intelligence with each hit."
5379,Last Word,"Enchants a target, providing vision of them and causing them to be damaged and silenced if they cast a spell or if the enchantment timer expires. Deals extra damage based on the difference in intelligence between Silencer and the target."
5380,Global Silence,"Silencer stops all sound, preventing enemy heroes and units on the map from casting spells."
5391,Arcane Orb,"Adds extra pure damage to Outworld Destroyer's attacks, based on his remaining mana pool."
5392,Astral Imprisonment,"Places a target unit into an astral prison. The hidden unit is invulnerable and disabled. When the astral prison implodes, it deals damage to the target and steals a percentage of their max mana."
5684,Essence Flux,Passively grants you a chance to restore a percentage of your max mana each time you cast an ability.
5394,Sanity's Eclipse,Unleashes a psychic blast that deals to enemies based on the difference between your mana and the target's mana. Sanity's Eclipse can hit units trapped by Astral Imprisonment.
5395,Summon Wolves,"Summons two wolves to fight for Lycan.  Level 3-4 wolves have Permanent Invisibility, and level 4 wolves have Cripple."
5396,Howl,"Strikes fear into enemies, reducing armor and attack damage to all enemies within %radius% range of Lycan and his wolves."
5397,Feral Impulse,Increases the HP regeneration and damage of Lycan and all units under his control.
333,Wolf Bite,"Lycan bites an ally, granting them Shapeshift properties. Lycan and the bitten target gain %lifesteal_percent%%% Lifesteal and share the healing effect of Lifesteal with each other as long as they are within %lifesteal_range% range of each other."
5398,Shapeshift,"Lycan assumes his lupine form, granting him and his units critical strikes and added vision at night. During Shapeshift, Lycan and all units under his control move at increased speed, cannot be slowed and have a %crit_chance%%% chance to deal a critical strike doing %crit_multiplier%%% damage."
5400,Thunder Clap,"Slams the ground, dealing damage and slowing the movement speed and attack rate of nearby enemy units."
7310,Cinder Brew,"Drenches an area in alcohol, causing enemy units to move slower and ignited once they take any spell damage. Duration is increased by %extra_duration% seconds when ignited."
5402,Drunken Brawler,"Brewmaster passively gains a chance to evade physical attacks and deal critical damage when attacking.  When activated, Brewmaster goes into a drunken brawler state, granting him increased chance to evade or deal critical damage. Brewmaster moves with a varying amount of movement speed, alternating between %min_movement%%% slower and %max_movement%%% faster. Lasts %duration% seconds."
5403,Primal Split,"Splits Brewmaster into elements, forming 3 specialized warriors, adept at survival, each with their own abilities. If any of them survive until the end of their summoned timer, the Brewmaster is reborn."
5421,Disruption,"Banishes the targeted unit from the battlefield for a short duration.  Upon returning, two illusions of the banished unit are created under Shadow Demon's control."
5422,Soul Catcher,"Captures the soul of enemy units in an area, causing them to lose a percentage of their current health. Shadow Demon temporarily gains Spell Amplification for each hero's soul captured. When the debuff is removed, the units gain half of the lost health back. Units under the effect of Disruption can still be affected by Soul Catcher."
5423,Shadow Poison,"Deals damage in a line, and afflicts enemy units with a poison effect. The poison deals 1/2/4/8/16 times the stack damage based on the number of stacks on the target, up to %max_multiply_stacks% stacks. Additional stacks cause %bonus_stack_damage% damage each.  This deferred damage is dealt when Shadow Poison's duration is expired, or the Release sub-ability is used."
5425,Demonic Purge,"Purges the target enemy unit, removing positive buffs, and slowing the target for the duration.  The unit slowly regains its speed until the end of the duration, upon which damage is dealt.  Units under the effect of Disruption can still be affected by Demonic Purge.

DISPEL TYPE: Basic Dispel"
5412,Summon Spirit Bear,"Summons a powerful Spirit Bear companion that can equip items.  If the bear moves 1100 distance away from the Lone Druid, it cannot attack.  Lone Druid suffers %backlash_damage%%% of his max health as backlash damage if the Spirit Bear dies. Spirit Bear does not benefit from attributes.
Spirit Bear has the Return, Demolish and Entangling Roots abilities."
7309,Spirit Link,"Links Lone Druid and the Spirit Bear, increasing the attack speed of both and causing damage dealt by the Spirit Bear to heal Lone Druid."
5414,Savage Roar,Lone Druid and the Spirit Bear roar fiercely causing nearby enemies to flee towards their base in terror. Their movement speed is increased by %bonus_speed%%%.
5415,True Form,"Lone Druid learns to morph himself into a raging bear, losing his ranged advantage, but gaining increased resistance, and improved versions of Entangling Roots and Demolish."
5426,Chaos Bolt,Throws a mysterious bolt of energy at the target unit. It stuns for a random duration and deals random damage.
5427,Reality Rift,"Teleports Chaos Knight, any images he has, and the target unit to a point along the line between him and the target. Reduces armor of the enemy unit for %duration% seconds."
5428,Chaos Strike,"Chaos Knight's attacks have a chance to deal a critical strike of varying strength, in addition to a lifesteal for percentage of the damage."
5429,Phantasm,"Summons several phantasmal copies of the Chaos Knight from alternate dimensions. The phantasms are strong illusions that deal %outgoing_damage_tooltip%%% damage, but take %incoming_damage_tooltip%%% damage.
DISPEL TYPE: Basic Dispel"
5430,Earthbind,"Tosses a net at the target point, rooting down all enemy units in an area around it."
5431,Poof,"Drawing mystical energies from the earth, a Meepo can teleport to another Meepo or itself after channeling for %abilitycastpoint% seconds, dealing damage in both the departure and arrival locations."
7318,Ransack,Steals health from the enemy with each strike and heals all other Meepos for that amount.
547,Dig,"Channels for 0.75 seconds and digs into the ground for 3.5 seconds, dispelling Meepo and causing him to be come invulnerable and untargetable for %duration%. Restores %hp_restore%%% of his max health over that duration. Can’t be cast while rooted."
5433,Divided We Stand,"Meepo summons an imperfect, semi-autonomous duplicate of himself, which can gain gold and experience as he does and shares his experience, attributes and abilities. However, the clones cannot wield any items but the boots that Meepo himself wears.  If any of the clones die, they all die."
338,Nature's Grasp,Creates vines towards the target location. Vines slow down and deal damage to enemies that walk through. Vines deal 50% more damage if they touch a tree. Does half damage to creeps.
5435,Leech Seed,"Treant plants a life-sapping seed in an enemy unit, draining its health, while simultaneously slowing it. The seed heals friendly units around it."
5436,Living Armor,Infuses the target hero or structure with a protective coating which heals the target and provides bonus armor.
5649,Eyes In The Forest,"Treant Protector enchants a tree, which grants him unobstructed vision in that location. If Overgrowth is cast, units within a radius of an enchanted tree will be entangled and damaged. Passively causes all trees to respawn much faster."
5434,Nature's Guise,"Provides Treant with Tree Walking whenever he hasn't taken damage for %cooldown_time% seconds. While active, Treant gains movement speed bonus and amplified healing and regeneration on himself."
5437,Overgrowth,"Summons an overgrowth of vines and branches around Treant that deal damage to afflicted enemies and prevent them from moving, blinking, going invisible, or attacking."
5438,Fireblast,"Blasts an enemy unit with a wave of fire, dealing damage and stunning the target."
5439,Ignite,"Drenches the target and another random unit in volatile chemicals, causing it to burst into flames. The target is in immense pain, taking damage and moving more slowly."
5440,Bloodlust,"Incites a frenzy in a friendly unit, increasing its movement speed and attack speed. Gives bonus attacks speed if cast on Ogre himself. Can be cast on towers."
5466,Unrefined Fireblast,"Blasts an enemy unit with a wave of fire, dealing damage and stunning the target. Its mana cost is %scepter_mana%%% of Ogre Magi's current mana."
648,Fire Shield,"Creates a shield around the target ally, absorbing 85%% of the damage of next %attacks% attacks. Launches fireballs at the attacker, dealing %damage% damage.<br><br>Lasts %duration% seconds."
5441,Multicast,Enables Ogre Magi to cast his abilities and items multiple times with each use.
5442,Decay,"Undying steals strength from all enemy heroes in an area, dealing base damage as he claims the enemy's strength for himself."
5443,Soul Rip,"Undying rips health away from all nearby units and uses it to heal an ally, or damage an enemy. Soul Rip can also be used to heal Tombstone."
5444,Tombstone,"Summons a tombstone at the target point.  Zombies will frequently spawn next to every enemy unit in the area around the Tombstone, and attack them.  Zombies have the Deathlust ability, which causes their attacks to slow the target, and if the target reaches below a certain amount of health, increases the attack and movement speed of the zombie."
5447,Flesh Golem,Undying transforms into a horrifying flesh golem. Gains a percentage increase to strength and imbues attacks with a slow and damage amplification.
5448,Telekinesis,Rubick uses his telekinetic powers to lift the enemy into the air briefly and then hurls them back at the ground. The unit lands on the ground with such force that it stuns nearby enemies.
5450,Fade Bolt,"Rubick creates a powerful stream of arcane energy that travels between enemy units, dealing damage and reducing their attack damage. Each jump deals less damage."
7320,Arcane Supremacy,Rubick's mastery of the arcane allows him to have a larger cast range and increased potency.
5452,Spell Steal,"Rubick studies the trace magical essence of one enemy hero, learning the secrets of the last spell the hero cast. Rubick can use this spell as his own for several minutes or until he dies, and stolen spells last longer on enemies."
5458,Thunder Strike,Repeatedly strikes the targeted unit with lightning.  Each strike damages nearby enemy units in a small radius and slows enemy movement and attack speed by %slow_amount%%% for %slow_duration% seconds.  Provides vision of its target.
5459,Glimpse,Teleports the target hero back to where it was 4 seconds ago.  Instantly kills illusions.
5460,Kinetic Field,"After a short formation time, creates a circular barrier of kinetic energy that enemies can't pass."
