id,name,description
5147,Demonic Conversion,"Transforms a creep into three fragments of Enigma himself.  These eidolons are all under Enigma's control, and repeated successful attacks cause them to multiply.  When this happens, the eidolons have their health restored."
5148,Midnight Pulse,"Steeps an area in dark resonance, damaging enemy units based on their max HP."
5149,Black Hole,"CHANNELED - Summons a vortex that sucks in nearby enemy units.  Enemies affected by Black Hole cannot move, attack, or cast spells."
5150,Laser,"Fires an intense energy beam, dealing damage to the target and all enemy units around it. The main target is blinded, causing them to miss all physical attacks."
5151,Heat-Seeking Missile,Launches rockets at the nearest visible heroes within %radius% range.
650,Defense Matrix,"Targets an allied unit, applying a barrier to them that blocks some damage and provides Status Resistance."
5152,March of the Machines,Enlists an army of robotic minions to destroy enemy units in an area around Tinker.
4646,Keen Conveyance,After channeling for %abilitychanneltime%s teleport to a target friendly structure. Level 2 allows teleporting to friendly units and Level 3 to friendly heroes.
5153,Rearm,CHANNELED - Resets the cooldown on most of Tinker's items and abilities.
5154,Shrapnel,Consumes a charge to launch a ball of shrapnel that showers the target area in explosive pellets. Enemies are subject to damage and slowed movement. Reveals the targeted area. Shrapnel charges restore every %abilitychargerestoretime% seconds.
5155,Headshot,"Sniper increases his accuracy, giving him a chance to deal extra damage and briefly knocks back his enemies."
5156,Take Aim,Extends the attack range of Sniper's rifle. Can be activated to provide %headshot_chance%%% Headshot chance for 3 seconds. Slows you by %slow%%% for the duration.
694,Concussive Grenade,"Grants Concussive Grenade. Deals 125 damage, knocking enemies back 475 distance, slowing them by 50%% and disarming them for 3 seconds. Radius: 375. Knocks you back 475 units on cast."
5157,Assassinate,"Sniper locks onto a target enemy unit and, after a short aiming duration, fires a devastating shot that deals damage at long range and mini-stuns the target."
5158,Death Pulse,"Necrophos releases a wave of death around him, dealing damage to enemy units and healing allied units."
5160,Ghost Shroud,"Necrophos slips into the realm that separates the living from the dead. Unable to attack or be attacked, he emits an aura that slows enemies around him. He takes additional magic damage in this form, but his restorative powers are amplified."
5159,Heartstopper Aura,"Necrophos stills the hearts of his opponents, causing nearby enemy units to lose a percentage of their max health over time. Passively provides regen for %regen_duration% seconds for each unit Necrophos kills."
661,Death Seeker,"Spawns a fast moving large Death Pulse towards the target enemy or ally, causing the target to become ethereal for 2.5 seconds. Reduces enemy magic resistance by 25%. Spreads towards nearby enemies and allies after impact."
5161,Reaper's Scythe,"Stuns the target enemy hero, then deals damage based on how much life it is missing. Heroes killed by Reaper's Scythe will have %respawn_constant% seconds added to their respawn timer. Any kill under this effect is credited to Necrophos."
5162,Fatal Bonds,"Binds several enemy units together, causing a percentage of the damage dealt to one of them to be felt by the others."
5163,Shadow Word,"Warlock whispers an incantation, healing a friendly unit or damaging an enemy unit over time."
5164,Upheaval,CHANNELED - A powerful slowing current that grows stronger as it's channelled. Lasts up to %abilitychanneltime% seconds.  Enemies are slowed for %duration% seconds after leaving the area or the spell ends.
5165,Chaotic Offering,"Summons a Golem from the depths, stunning enemies for one second. The Golem lives %golem_duration% seconds, takes reduced damage from spells, has Permanent Immolation and Flaming Fists on attack."
5168,Wild Axes,"Beastmaster sends his axes flying and calls them home again, slicing through enemy units and trees along their path.  Each axe can hit an enemy once, and amplifies subsequent damage from Beastmaster and his units."
7230,Call of the Wild Boar,Beastmaster calls forth a Boar to aid in the battlefield.
7231,Call of the Wild Hawk,Beastmaster sends an invisible Hawk to scout an area.
5172,Inner Beast,"Untaps the inner fury of nearby allies, passively increasing their attack speed."
5177,Primal Roar,"Beastmaster lets loose a deafening roar that stuns, and shoves open a path to its target. All units in the path of the roar are damaged, while units shoved aside by the roar have their movement and attack speed slowed. Additionally, Beastmaster and his units gain %movement_speed%%% movement speed for 3 seconds."
5173,Shadow Strike,"Hurls a poisoned dagger which deals large initial damage, and then deals damage over time. The poisoned unit has its movement speed slowed for %duration% seconds.  An instance of damage is dealt every %damage_interval% seconds. Queen of Pain relishes in the pain inflicted, healing every time the enemy takes damage. Creeps heal for half the damage only."
5174,Blink,Short distance teleportation that allows Queen of Pain to move in and out of combat.
5175,Scream Of Pain,"The Queen of Pain lets loose a piercing scream around her, damaging nearby enemies."
5176,Sonic Wave,"Creates a gigantic wave of sound in front of Queen of Pain, dealing heavy damage to all enemy units in its wake and pushing them back."
5178,Venomous Gale,"Launches a ball of venom in a line, poisoning enemy units so that they take both initial damage and damage over time, as well as suffering slowed movement.  Venomous Gale deals damage every 3 seconds over its duration."
5179,Poison Sting,Adds poison damage to Venomancer's normal attacks and slowing movement speed.
5180,Plague Ward,"Summons a plague ward to attack enemy units and structures. The ward is immune to magic. Wards gain the Poison Sting level from Venomancer, dealing 50% of the full damage."
5181,Poison Nova,A spreading ring of poison that does damage over time to enemy units around Venomancer.  Poison Nova cannot deal lethal damage; targets will be left with at least 1 health.
5182,Time Walk,Rushes to a target location while backtracking any damage taken the last %backtrack_duration% seconds.
5691,Time Dilation,"Faceless Void traps all nearby enemies in a time dilation field for %duration% seconds, extending their cooldowns and slowing their movement and attack speed by %slow%%% for each cooldown extended. Deals damage per second for each cooldown."
5184,Time Lock,Adds the chance for an attack to lock an enemy unit in time while attacking it a second time.
8030,Reverse Time Walk,"Replaces Time Walk with Reverse Time Walk for 1.5 seconds after landing. If used in this period, you will reverse your time walk back to your previous cast location. Does not affect health or proc scepter hits."
5185,Chronosphere,"Creates a blister in spacetime, trapping all units caught in its sphere of influence and causes you to move very quickly inside it.  Only Faceless Void and any units he controls are unaffected.  Invisible enemies in the sphere will be revealed."
5086,Wraithfire Blast,"Wraith King sears an enemy unit with spectral fire, dealing damage and stunning, then dealing damage over time and slowing the target."
5087,Vampiric Spirit,Restore health based on the damage Wraith King deals when attacking enemy units. Can be cast to summon skeletons with Vampiric Spirit. Every two kills on an enemy unit adds a skeleton charge. Skeletons respawn once when killed. 
5088,Mortal Strike,Wraith King passively deals bonus damage on an attack with a cooldown. 
5089,Reincarnation,"Wraith King's form regroups after death, allowing him to resurrect when killed in battle.  Upon death, enemy units in a %slow_radius% radius will be slowed."
5090,Crypt Swarm,Sends a swarm of winged beasts to savage enemy units in front of Death Prophet.
5091,Silence,Fires a projectile that prevents enemy units in a target area from casting spells.
5685,Spirit Siphon,"Creates a spirit link between Death Prophet and an enemy unit, draining health from the enemy."
5093,Exorcism,"Unleashes evil spirits to drain the life of nearby enemy units and structures. At the end of the spell's duration, Death Prophet is healed in proportion to the damage dealt. Lasts %abilityduration% seconds."
5190,Stifling Dagger,"Throws a dagger slowing the enemy unit's movement speed, dealing %base_damage%+%attack_factor_tooltip%%% of Phantom Assassin's attack damage as physical damage and applying attack effects from items and abilities."
5191,Phantom Strike,"Teleports to a unit, friendly or enemy, and grants bonus attack speed while attacking if it's an enemy unit."
5192,Blur,"Phantom Assassin focuses inward, increasing her ability to evade enemy attacks. Can be activated to blur her body, causing her to be impossible to see until near enemy heroes.

Stacks diminishingly with other sources of Evasion."
662,Fan of Knives,"Phantom Assassin releases sharp blades around her in a 550 AoE, dealing 16% of a victim's max health on impact and applying break for 3 seconds."
5193,Coup de Grace,"Phantom Assassin refines her combat abilities, gaining a chance of delivering a devastating critical strike to enemy units. Stifling Dagger shares the same critical strike chance."
5186,Nether Blast,An exploding pulse deals damage to enemies and structures in the area.  Deals half damage to structures.
5187,Decrepify,A powerful banishing spell that slows a unit and renders it unable to attack or be attacked. Afflicted units take extra magic damage.
5188,Nether Ward,Pugna places a Nether Ward at the target location. The ward will fire at any enemy hero who casts a spell dealing base damage plus the damage multiplier of the mana spent by the enemy hero. Nether Ward heals 25% of its total health every time it triggers.
5189,Life Drain,"CHANNELED - When cast on an enemy, Pugna drains health from the target enemy unit to heal himself and granting vision over the target. If Pugna has full HP, and the enemy target is a Hero, Life Drain will restore mana instead.

When cast on an ally, Pugna will drain his own health into his ally."
5194,Refraction,"Templar Assassin becomes highly elusive, avoiding damage and gaining a bonus to her damage.  The damage and avoidance effects are separate, and have a limited number of instances."
5195,Meld,"Templar Assassin conceals herself, becoming invisible as long as she remains still.  If Meld's invisibility is broken by attacking an enemy, Lanaya will deal bonus damage to the enemy and reduce their armor for %abilityduration% seconds."
5196,Psi Blades,"Templar Assassin's psi blades slice through the attacked unit, splitting and damaging enemy units directly behind it, while gaining bonus attack range. For each unit it damages, the spill damage is reduced by a percentage."
7853,Psionic Projection,Allows Templar Assassin to teleport from a nearby Psionic Trap to another after a brief channel. Does not break meld. Detonates both Psionic Traps on arrival.
5197,Psionic Trap,"Templar Assassin places mystical traps that invisibly monitor enemy movement. When sprung at her command, they exert a slowing influence of %movement_speed_min%%% in the area. Traps charge up to slow %movement_speed_max%%% after %trap_max_charge_duration% seconds. Deals bonus damage when fully charged."
5218,Poison Attack,"Intensifies Viper's venom, adding an effect to his normal attack that applies a stacking movement speed slow and magic resistance deduction while dealing damage over time. Stacks up to %max_stacks% times."
5219,Nethertoxin,Viper releases a Nethertoxin at the targeted area. Units in that area take an increasing damage over time based on how long they remain in it. Disables passives of affected units.
5220,Corrosive Skin,Viper exudes an infectious toxin that damages and slows the attack speed of any enemy that damages it in a %max_range_tooltip% radius. The acid exudate also increases Viper's resistance to magic.
5221,Viper Strike,Viper slows the targeted enemy unit's movement and attack speed while also dealing poison damage over time.  The slowing effect reduces over the duration of the poison.
5222,Lucent Beam,"Calls a beam of lunar energy down upon an enemy, damaging and briefly stunning them."
5223,Moon Glaives,"Empowers Luna's glaives, causing her attacks to bounce between enemy units. Deals less damage with each bounce."
5224,Lunar Blessing,Increases the attack damage for Luna and nearby allied heroes. Luna is also blessed with increased vision range at night.
5225,Eclipse,"Showers random nearby enemies with strikes from Luna's current level of Lucent Beam. These beams do not stun their targets, and there is a maximum number of times that a single target can be struck. Also turns day into night for %night_duration% seconds."
5226,Breathe Fire,Unleashes a breath of fire in front of Dragon Knight that burns enemies and reduces the damage their attacks deal.
5227,Dragon Tail,"Dragon Knight smites an enemy unit in melee range with his shield, stunning it while dealing minor damage.  When in Elder Dragon Form, the cast range increases to %dragon_cast_range%."
5228,Dragon Blood,The life blood of the Dragon improves health regeneration and strengthens armor.
660,Fireball,"Ignites a %radius% AoE area for %duration% seconds, dealing %damage% damage per second that lingers for %linger_duration% seconds to enemies in it. Has reduced cast range when melee."
5229,Elder Dragon Form,"Dragon Knight takes the form of one of three powerful elder dragons, increasing his speed, and Dragon Tail's range, while granting him new powers.
<font color=""#9acd32"">LEVEL 1 Green Dragon</font> - Corrosive Breath: attacks deal %corrosive_breath_damage% poison damage per second for %corrosive_breath_duration% seconds. Works on structures.
<font color=""#ff0000"">LEVEL 2 Red Dragon</font> - Splash Attack: attacks damage all enemy units in a %splash_radius% radius for %splash_damage_percent%%% damage, with Corrosive Breath added to the targets.
<font color=""#87ceeb"">LEVEL 3 Blue Dragon</font> - Frost Breath: slows movement speed by %frost_bonus_movement_speed%%% and attack speed by %frost_bonus_attack_speed% of enemy units in Splash Attack range for %frost_duration% seconds, with Corrosive Breath added to the targets."
5233,Poison Touch,"Releases a cone of poison that strikes multiple enemy units. Deals damage over time and slows the targets. Anytime the targets get attacked by Dazzle, the debuff duration is refreshed and slow is increased."
5234,Shallow Grave,"An ally blessed with Shallow Grave, no matter how close to death, cannot die while under its protection."
5235,Shadow Wave,"Sends out a bolt of power that arcs between allies, healing them while damaging any units standing nearby.  Dazzle is always healed by Shadow Wave."
7304,Bad Juju,"Passively reduces cooldowns on Dazzle's abilities and items. Anytime he casts a spell, all nearby enemies will have their armor reduced. Debuff stacks and refreshes duration."
5237,Battery Assault,"Discharges high-powered shrapnel at random nearby enemy units, dealing minor magical damage and ministun."
5238,Power Cogs,"Forms a barrier of energized cogs around Clockwerk, trapping any units that are near.  Enemies outside the trap that touch a cog are knocked back, losing health and mana. Once a cog has delivered a shock, it will power down.  Cogs can be destroyed by enemy attacks, but Clockwerk can destroy them with just one."
5239,Rocket Flare,"Fires a global range flare that explodes over a given area, damaging enemies and providing vision for %duration% seconds."
321,Overclocking,Resets Clockwerk's ability cooldowns and grants him bonus movement and attack speed for a duration. Clockwerk becomes stunned after the duration runs out.
630,Jetpack,"Rises up, granting Clockwerk flying vision, flying movement, and a %bonus_speed%%% bonus movement speed. Clockwerk has a severely-limited turn rate during this time and cannot attack. Lasts up to %duration% seconds or until he casts Hookshot."
5240,Hookshot,"Fires a grappling device rapidly at the target location.  If the hook hits a unit, Clockwerk launches himself into the target, stunning and dealing damage.  Any enemies Clockwerk collides with along the way are damaged and stunned."
5241,Split Earth,Splits the earth under enemies. Deals damage and stuns for a short duration.
5242,Diabolic Edict,"Saturates the area around Leshrac with magical explosions that deal pure damage to enemy units and structures.  The fewer units available to attack, the more damage those units will take. Lasts %abilityduration% seconds."
5243,Lightning Storm,"Summons a lightning storm that blasts the target enemy unit, then strikes any nearby enemy units. Struck enemies are slowed."
539,Nihilism,"Causes all nearby enemies in %radius% AoE to turn ethereal, preventing them from attacking, causing them to take %magic_amp%%% more magic damage and be slowed by %slow%%% for %duration% seconds. Increases Leshrac's speed rather than reducing it. Does not cause you to take amplified damage."
5244,Pulse Nova,"Creates waves of damaging energy around Leshrac, one per second, to damage nearby enemy units. Drains Leshrac's mana with each pulse."
5245,Sprout,"Sprouts a ring of trees around a unit, trapping it in place, and providing vision in a %vision_range% radius."
5246,Teleportation,Teleports to any point on the map.
5247,Nature's Call,Converts an area of trees into Treants under the command of Nature's Prophet.
5248,Wrath of Nature,"Damaging energy bounces around the map, striking enemies close to the cast point that are in vision. Each enemy hit beyond the first adds damage. Enemies that die under this spell grant you bonus damage for %kill_damage_duration% seconds."
5249,Rage,"Launch into a maddened rage, becoming Spell Immune, and gaining increased movement speed.

DISPEL TYPE: Basic Dispel"
5250,Feast,Lifestealer's attacks deal damage and provide heal for a percentage of his target's max health.
631,Ghoul Frenzy,Passively causes Lifestealer's attacks to significantly slow enemy movement speed for %duration% seconds. Grants you Attack Speed.
5251,Open Wounds,"Lifestealer rends an enemy unit, slowing the victim's movement speed and allowing all allies to regain health for a percentage of the damage they deal to that unit. All damage dealt will steal life, including damage from spells. The victim recovers movement speed over the duration. Deals 2% of the target's max health per attack on the target from real heroes."
5252,Infest,"Lifestealer infests the body of a target unit, becoming undetectable, and healing for a portion of his max hitpoints every second while inside. He can then explode from the host body, dealing damage to nearby enemies. If the infested unit is an enemy creep or a neutral creep, he can take control of the unit's ability to move and attack. Does not work on enemy heroes.

DISPEL TYPE: Basic Dispel"
5255,Vacuum,"Dark Seer creates a vacuum over the target area that sucks in enemy units, disrupting them and dealing damage."
5256,Ion Shell,Surrounds the target unit with a bristling shield that damages enemy units in an area around it.
5257,Surge,"Charges a target friendly unit with power, giving it a brief burst of movement speed and removes unit collisions. Allows the unit to reach maximum movement speed and cannot be slowed."
687,Normal Punch,"Grants Normal Punch. Passive cooldown attack. Causes Dark Seer's next attack on a hero to have True Strike, knock an illusion out of the victim and stun them for up to 2.25 seconds, 350 distance and 300 magic damage based on how far Dark Seer has moved in the past 3 seconds. Max power is reached after 900 distance moved. Illusions lasts for 8 seconds. Cooldown: 14"
5258,Wall of Replica,"Raises a wall of warping light that slows and creates replicas of any enemy hero who crosses it. Enemy replicas serve at the Dark Seer's will. Replicas last until they are destroyed, or until the wall's duration ends."
5259,Burning Barrage,Clinkz channels and shoots multiple piercing arrows in the target direction that hit all enemy units dealing a percentage of Clinkz' attack damage and applying attack modifiers.
5260,Searing Arrows,Imbues Clinkz's arrows with fire for extra damage.
5261,Skeleton Walk,Clinkz moves invisibly through units until the moment he attacks or uses items.
7319,Burning Army,"Clinkz summons an army of fiery ranged skeleton archers. Archers are immobile and die with 2 attacks from a hero. Skeletons deal a percentage of Clinkz' damage, use his current Searing Arrows ability and attack only heroes. Attack range is equal to Clinkz's attack range."
5262,Death Pact,"Clinkz consumes the target enemy unit or friendly unit, gaining max health and damage based on its current health. Does not take Clinkz out of Skeleton Walk."
5263,Purification,Instantly heals a friendly unit and damages all nearby enemy units.
5264,Heavenly Grace,"Creates a divine barrier around an ally which grants them increased Status Resistance, Strength and Health Regeneration.

DISPEL TYPE: Strong Dispel"
5265,Degen Aura,Greatly degenerates the movement capabilities of enemy units that stray too near.
656,Hammer of Purity,Causes Omniknight's next attack to deal bonus pure damage based on %bonus_damage% plus %base_damage%%% of his base damage and reduces all outgoing damage from the target by 60% for the next 4 seconds. Cooldown: 10
5266,Guardian Angel,Omniknight calls upon a Guardian Angel that grants allies immunity from physical damage.
5270,Impetus,"Places an enchantment on each attack while activated, causing it to deal additional damage based on how far away the target is.  The farther the target, the greater the damage dealt."
5268,Enchant,"Enchantress charms an enemy. If the enemy is a hero, they are slowed. If the enemy is a creep, she brings it under her control, increasing its attack damage and max health.

DISPEL TYPE: Basic Dispel"
5269,Nature's Attendants,A cloud of wisps heals Enchantress and any friendly units nearby. Lasts %abilityduration% seconds.
320,Sproink,"Leaps backward, dodges incoming projectiles, and launches an Impetus attack on the 3 furthest enemy units within Enchantress' attack range + 200."
5267,Untouchable,"Enchantress beguiles her enemies, slowing their attacks when she is attacked."
7300,Inner Fire,"In a fiery rage, knocks all nearby enemies away from you to a fixed distance, dealing damage and disarming them."
5272,Burning Spear,"Huskar sets his spears aflame, dealing damage over time with his regular attack.  Multiple attacks will stack additional damage.  Each attack drains some of Huskar's health."
5273,Berserker's Blood,"Huskar's injuries feed his power, giving increased attack speed and health regen based on missing health. Health regen is a percentage of your strength."
5274,Life Break,"Huskar draws upon his health to break an enemy's life, leaping at a target within attack range to shatter a percentage of that hero's current health, and slowing them.  While leaping, Huskar is Spell Immune.

DISPEL TYPE: Basic Dispel"
5275,Void,"Creates a damaging void that slows an enemy unit and deals damage.  Void also mini-stuns, interrupting channeling abilities. The slowing effect lasts longer at night."
5276,Crippling Fear,"Night Stalker horrifies all nearby enemies, causing them to become silenced while near him.  The effect lasts longer at night."
5277,Hunter in the Night,"Night Stalker is in his element at night, attacking and moving with great swiftness."
5278,Dark Ascension,"Night Stalker smothers the sun and summons instant darkness, so that he might use his powers at their fullest. Night Stalker gains flight and bonus damage during this time. Has unobstructed vision."
5282,Insatiable Hunger,A violent lust for vital fluids increases Broodmother's attack damage and gives her a vampiric attack.
5280,Spin Web,"Spins a large web that grants Broodmother a passive movement speed increase, and boosts regeneration while in its vicinity, as well as giving free movement. Spin Web charges restore every %charge_restore_time% seconds. Spin Web can be cast from anywhere as long as the new web touches an existing web. Webs never expire, and can be manually destroyed. When the maximum limit of webs is exceeded, the oldest web disappears. The movement bonus is proportional to the unit's HP"
639,Silken Bola,"Slows the target enemy, causes them to miss and deals impact damage. Units that attack the target deal bonus magic damage."
873,Spinner's Snare,"Broodmother creates a 900 width invisible web line. Enemy Heroes that cross the web line will make it visible and become rooted, visible in fog and receive 100dps for 4 seconds, after which the line is destroyed. Broodmother's team is notified in the Minimap whenever someone trips in a Web line. Multiple Heroes can trip on the same line until it's destroyed. Can only have 5 Snares Active. Formation Delay: 2, Cast Range: 600, Slow Duration: 0.25, Slow: 100%, Root Duration: 4, DPS: 100"
5279,Spawn Spiderlings,"Broodmother injects her young into an enemy unit, dealing damage. The spiderlings will hatch if the target is killed while under this influence."
5285,Shuriken Toss,"Hurls a deadly shuriken at an enemy unit, dealing damage and mini-stunning the target.  The shuriken will bounce to any Tracked units who are within a %bounce_aoe% radius of each other."
5286,Jinada,"Bounty Hunter plans his next hit, dealing bonus damage and stealing some unreliable gold."
